{"schemaVersion":1,"boundaryId":"B-APPLY-RESTART","boundaryRevision":1,"evidenceType":"partial-integration","transitions":[{"transitionId":"RESTART-AFTER-APPLYING","expected":{"throws":false,"stageAfter":"APPLIED","applicationAfter":{"status":"APPLIED"}}},{"transitionId":"RESTART-WORKER-RUNNING","expected":{"throws":false,"stageAfter":"RECOVERY_REQUIRED","errorMessage":"Server restarted during execution. No automatic resubmission or patch application."}},{"transitionId":"RESTART-AWAITING-APPLY","expected":{"throws":false,"stageAfter":"AWAITING_APPLY"}},{"transitionId":"RESTART-APPLIED","expected":{"throws":false,"stageAfter":"APPLIED","applicationAfter":{"status":"APPLIED"}}}],"retiredTransitions":[{"transitionId":"RESTART-TREE-DRIFT","reason":"recover() reads actual Git tree, not stored application.result.tree. Stored record mutation has no effect."}]}