{"schemaVersion":3,"boundaryId":"B-APPLY-INPUT","boundaryRevision":3,"evidenceType":"partial-integration","entryPoint":"service.command","transitions":[{"transitionId":"A-STAGE","expected":{"throws":true,"errorMessage":"Command unavailable for this code change.","stageAfter":"REVIEW_RUNNING","applicationAfter":"absent"}},{"transitionId":"A-JOB","expected":{"throws":true,"errorMessage":"Command unavailable for this code change.","stageAfter":"AWAITING_APPLY","applicationAfter":"absent"}},{"transitionId":"A-STOP","expected":{"throws":true,"errorMessage":"Command unavailable for this code change.","stageAfter":"unchanged","applicationAfter":"absent"}},{"transitionId":"B-SCHEMA","expected":{"throws":true,"errorMessage":"Approval does not identify a valid independently reviewed candidate.","stageAfter":"AWAITING_APPLY","applicationAfter":"absent"}},{"transitionId":"B-AUDIT","expected":{"throws":true,"errorMessage":"Approval does not identify a valid independently reviewed candidate.","stageAfter":"AWAITING_APPLY","applicationAfter":"absent"}},{"transitionId":"C-CANDIDATE","expected":{"throws":true,"errorMessage":"Approval does not identify the reviewed candidate.","stageAfter":"unchanged","applicationAfter":"absent"}},{"transitionId":"C-REVIEW","expected":{"throws":true,"errorMessage":"Approval does not identify the reviewed candidate."}},{"transitionId":"C-ARTIFACT","expected":{"throws":true,"errorMessage":"Approval does not identify the reviewed candidate."}},{"transitionId":"C-BASE","expected":{"throws":true,"errorMessage":"Approval does not identify the reviewed candidate."}},{"transitionId":"C-VERSION","expected":{"throws":true,"errorCode":"RUN_VERSION_CONFLICT","errorMessage":"Run changed; refresh."}},{"transitionId":"D-PASS","expected":{"throws":false,"stageAfter":"APPLIED","applicationAfter":{"status":"APPLIED","hasFields":["applicationId","candidateId","reviewId","baseCommit","createdAt"]}}},{"transitionId":"E-IDEMPOTENT","expected":{"throws":true,"errorMessage":"Command unavailable for this code change.","stageAfter":"APPLIED","applicationAfter":"unchanged"}}],"retiredTransitions":[{"transitionId":"B-REVIEW","reason":"command()로 도달 불가."},{"transitionId":"B-TREE","reason":"public API 조작으로 assert 실패 유도 불가."},{"transitionId":"B-MANIFEST","reason":"B-TREE와 동일."}]}